{
  "$schema": "../../tools/zenkai-catalog-api/manifest.schema.json",
  "schemaVersion": 1,
  "title": "Evolution Companions — Complete 8-Plush Collector Set",
  "handle": "evolution-companions-complete-8-plush-collector-set",
  "descriptionHtml": "<p><strong>Eight little companions. One complete collection.</strong></p><p>Bring home every colorful hood, stitched smile and tiny pair of brown paws. Pick your first favorite, then find a spot for the whole lineup.</p><h3>Your complete set</h3><ul><li>Eight separate plushes, one of every pictured design</li><li>Approximately 8 × 7 × 6 inches each</li><li>Free U.S. shipping; delivery typically takes 5–7 business days</li></ul><h3>Care</h3><p>Spot clean gently and air dry. Not suitable for children under 3 years old.</p><h3>Delivery and returns</h3><p>Your set may arrive separately from other items in your order. If your order is lost in transit, damaged, defective, incorrect or materially different from its description, contact us with your order number and available photos. <a href=\"/pages/policy\">View delivery and returns.</a></p>",
  "vendor": "Zenkai Clothing",
  "productType": "Plush Collector Set",
  "templateSuffix": "evolution-companions",
  "tags": [
    "8 Piece Set",
    "Aftersell Upsell",
    "Cart Upsell",
    "Complete Collection",
    "Direct Ship",
    "One Click Upsell",
    "Plush Collector Set",
    "Post Purchase Upsell",
    "Unlisted Offer"
  ],
  "seo": {
    "title": "Evolution Companions Complete 8-Plush Set | Zenkai",
    "description": "All eight Evolution Companions plushes in one complete set. Colorful hoods, stitched smiles and a favorite for every spot. Free U.S. shipping."
  },
  "options": [
    {
      "name": "Title",
      "values": [
        "Complete 8-Plush Set"
      ]
    }
  ],
  "variants": [
    {
      "sku": "ZK-PLUSH-EVO-8",
      "price": "160.00",
      "compareAtPrice": "200.00",
      "options": {
        "Title": "Complete 8-Plush Set"
      },
      "tracked": true,
      "requiresShipping": true,
      "taxable": true,
      "inventoryPolicy": "CONTINUE",
      "weight": {
        "value": 32,
        "unit": "OUNCES"
      },
      "inventory": [
        {
          "locationName": "PO BOX",
          "quantity": 100
        }
      ]
    }
  ],
  "images": [
    {
      "source": "generated-images/evolution-companions-8-pack-hero.png",
      "alt": "Complete set of eight brown plush companions in pink, lavender, pale blue, blue, orange, yellow, gold, and black elemental costumes",
      "variantSkus": [
        "ZK-PLUSH-EVO-8"
      ]
    },
    {
      "source": "customer-photos/customer-01-complete-lineup.png",
      "alt": "Customer photo of all eight plush companions arranged together on a sofa"
    },
    {
      "source": "customer-photos/customer-02-pink-purple-orange.png",
      "alt": "Customer photo of the pink, lavender, and orange plush companions"
    },
    {
      "source": "customer-photos/customer-03-purple-closeup.png",
      "alt": "Customer close-up of the lavender gem-eared plush companion"
    },
    {
      "source": "customer-photos/customer-04-pink-closeup.png",
      "alt": "Customer close-up of the pink-and-white ribboned plush companion"
    },
    {
      "source": "customer-photos/customer-05-blue-shelf.png",
      "alt": "Customer photo of the blue aquatic plush companion on a collector shelf"
    },
    {
      "source": "customer-photos/customer-06-black-closeup.png",
      "alt": "Customer close-up of the black and yellow moon-ring plush companion"
    }
  ]
}
