{
  "$schema": "../../tools/zenkai-catalog-api/manifest.schema.json",
  "schemaVersion": 1,
  "title": "Eternal Wish — 24cm Dragon & Hero Display Figure",
  "handle": "eternal-wish-24cm-dragon-hero-display-figure",
  "descriptionHtml": "<p><strong>Some legends don’t enter the room quietly.</strong></p><p>Coiled through storm clouds with a young hero riding at its center, this finished display figure turns one of anime’s most unforgettable wish-making moments into a shelf-sized centerpiece. The looping dragon silhouette brings movement from every angle, while the cloud-and-rock base gives the whole scene the presence it deserves.</p><p>It’s bold without feeling like clutter. Familiar without needing an introduction. Built for the shelf that still remembers the wish.</p><hr><p><strong>⚡ Display Details:</strong></p><ul><li>Approximately 9.4 in (24 cm) tall</li><li>Painted PVC construction</li><li>Dynamic coiled-dragon sculpture with a cloud-and-rock display base</li><li>Includes a young hero riding a translucent golden cloud</li><li>Finished display model</li><li>Approximately 1:12 scale, according to the supplier</li><li>Collector-box packaging</li></ul><hr><p><strong>Big silhouette. Familiar energy. Zero need for an introduction.</strong></p><p><em>Display collectible. Small parts may be present; not intended for young children. Because each piece is finished individually, minor differences in paint, color, and measurements may occur.</em></p>",
  "vendor": "Zenkai Clothing",
  "productType": "Collectible Figure",
  "tags": [
    "Anime Collectible",
    "Collector Display",
    "Dragon Figure",
    "Gift for Collectors",
    "PVC Figure",
    "Shelf Display"
  ],
  "templateSuffix": "eternal-wish",
  "seo": {
    "title": "Eternal Wish 24cm Dragon & Hero Display Figure",
    "description": "A dynamic 24cm painted PVC dragon-and-hero display figure with a sculpted cloud base and collector-box packaging."
  },
  "options": [
    {
      "name": "Title",
      "values": [
        "Default Title"
      ]
    }
  ],
  "variants": [
    {
      "sku": "ZK-FIG-EW24-PVC",
      "price": "49.99",
      "compareAtPrice": "99.99",
      "options": {
        "Title": "Default Title"
      },
      "tracked": false,
      "requiresShipping": true,
      "taxable": true,
      "inventoryPolicy": "DENY",
      "inventory": []
    }
  ],
  "images": [
    {
      "source": "source-images/08.jpg",
      "alt": "Front view of the Eternal Wish green dragon and young hero display figure",
      "variantSkus": [
        "ZK-FIG-EW24-PVC"
      ]
    }
  ]
}
